Title,Link
A Perfect Weekend in Scottsdale: 3 Jam-Packed Days!,https://myperfectitinerary.com/weekend-in-scottsdale/
Best Things to do in Scottsdale for Couples!,https://myperfectitinerary.com/best-things-to-do-in-scottsdale-for-couples/
23 UNIQUE Things to do in La Fortuna – Time for an adventure!,https://myperfectitinerary.com/things-to-do-in-la-fortuna/
10 Days in Costa Rica – Explore The Jungle & The Coast!,https://myperfectitinerary.com/10-days-in-costa-rica-explore-the-jungle-the-coast/
27 Things to do in Buena Park for the PERFECT Girls Weekend!,https://myperfectitinerary.com/things-to-do-in-buena-park/
Weekend in Vegas Itinerary – A Perfect 3 Days in Las Vegas!,https://myperfectitinerary.com/weekend-in-vegas-itinerary/
A Jam-Packed Capri Day Trip from the Amalfi Coast!,https://myperfectitinerary.com/capri-day-trip/
An EPIC 2 Week Italy Itinerary (With Amalfi Coast)!,https://myperfectitinerary.com/2-week-italy-itinerary-with-amalfi-coast/
A Romantic Lake Como Itinerary for Your Italian Summer Holiday!,https://myperfectitinerary.com/lake-como-itinerary/
Utah National Parks Road Trip – 14 EPIC DAYS!,https://myperfectitinerary.com/utah-national-parks-road-trip/
